{
  "accessorials": [
    {
      "amount": "250.00",
      "clause": "§4",
      "label": "Residential delivery",
      "quote": "Residential delivery (consignee address is a residence, or the booking is flagged residential): ₹250.00 flat per consignment.",
      "when": {
        "special_handling": "residential"
      }
    }
  ],
  "carrier": "falcon",
  "chargeable_weight": null,
  "contract_file": "falcon-freight.md",
  "contract_sha256": "6e37557aad7f22da8103e960de6807385088ff0f4bca6fe8da22726998233ca0",
  "credit_notes": {
    "allowed": true,
    "clause": "§8",
    "must_cover_full": false,
    "quote": "The Carrier may issue credit notes correcting earlier invoices. A credit note references the original consignment note number and states the invoice it corrects."
  },
  "dispute_window": {
    "clause": "§7",
    "days": 45,
    "from": "invoice_date",
    "quote": "Billing disputes must be raised within 45 days of invoice date. Disputed line items are payable only on resolution; undisputed items remain due."
  },
  "freight": {
    "components": [
      {
        "bands": [
          {
            "max_inclusive": true,
            "max_kg": "500",
            "min_inclusive": false,
            "min_kg": null,
            "rate": "18.00"
          },
          {
            "max_inclusive": true,
            "max_kg": "2000",
            "min_inclusive": true,
            "min_kg": "501",
            "rate": "24.00"
          }
        ],
        "basis": "per_km",
        "clause": "§1",
        "label": "Base freight per km by billed weight",
        "quote": "Base freight is charged per kilometre of the booked lane distance, according to the consignment's billed weight: - up to and including 500 kg: ₹18.00 per km - 501 kg to 2,000 kg: ₹24.00 per km",
        "weight_basis": "billed"
      }
    ]
  },
  "invoice_discounts": [],
  "non_pricing": [
    {
      "clause": "§6",
      "summary": "Invoicing is fortnightly and payment is due 30 days from invoice date; timing terms with no effect on price calculation."
    }
  ],
  "other_accessorials": {
    "allowed": false,
    "clause": "§5",
    "quote": "No other accessorial charges are payable under this agreement. Any service outside this schedule requires the Customer's written agreement in advance, evidenced by a rate confirmation referencing this agreement."
  },
  "service_levels": {
    "allowed": [
      "standard",
      "express"
    ],
    "clause": "§2",
    "quote": "Express service, where booked, carries a premium of 15% of the base freight."
  },
  "surcharges": [
    {
      "base": "freight",
      "clause": "§2",
      "label": "Express service premium",
      "pct": "15",
      "quote": "Express service, where booked, carries a premium of 15% of the base freight.",
      "when": {
        "service_level": "express"
      }
    },
    {
      "base": "freight_and_prior_surcharges",
      "clause": "§3",
      "label": "Fuel surcharge",
      "pct": "12",
      "quote": "A fuel surcharge of 12% applies to the freight charge (base freight plus express premium, where applicable).",
      "when": {
        "always": true
      }
    }
  ],
  "unmatched_lines": null,
  "unsupported": []
}
