{
  "accessorials": [],
  "carrier": "sagar",
  "chargeable_weight": null,
  "contract_file": "sagar-roadlines.md",
  "contract_sha256": "43c3f2dfc4e0eade16e79d4924f4b83c8748dc1a06dfaf3bc2694369aaa5ad95",
  "credit_notes": {
    "allowed": true,
    "clause": "§6",
    "must_cover_full": true,
    "quote": "The Carrier may issue credit notes correcting earlier invoices. A credit note references the original c-note number and the invoice it corrects, and must cover the full corrected amount."
  },
  "dispute_window": null,
  "freight": {
    "components": [
      {
        "bands": [
          {
            "max_inclusive": false,
            "max_kg": null,
            "min_inclusive": false,
            "min_kg": null,
            "rate": "6.00"
          }
        ],
        "basis": "per_kg",
        "clause": "§1",
        "label": "Weight component",
        "quote": "a weight component of ₹6.00 per kg of billed weight",
        "weight_basis": "billed"
      },
      {
        "bands": [
          {
            "max_inclusive": false,
            "max_kg": null,
            "min_inclusive": false,
            "min_kg": null,
            "rate": "2.00"
          }
        ],
        "basis": "per_km",
        "clause": "§1",
        "label": "Distance component",
        "quote": "a distance component of ₹2.00 per km of the booked lane distance",
        "weight_basis": "billed"
      }
    ]
  },
  "invoice_discounts": [],
  "non_pricing": [
    {
      "clause": "§4",
      "summary": "Carrier invoices as trips are pooled, typically fortnightly; payment is due 21 days from invoice date."
    },
    {
      "clause": "§5",
      "summary": "The c-note number on each invoice line is the Carrier's reference and must correspond to a Customer booking."
    }
  ],
  "other_accessorials": {
    "allowed": false,
    "clause": "§1",
    "quote": "Freight per consignment is the sum of:"
  },
  "service_levels": {
    "allowed": [
      "standard"
    ],
    "clause": "§2",
    "quote": "Only standard service is offered under this agreement."
  },
  "surcharges": [
    {
      "base": "freight",
      "clause": "§3",
      "label": "Cold chain premium",
      "pct": "20",
      "quote": "Consignments booked as cold chain travel in refrigerated vehicles and carry a premium of 20% on the freight charge (the sum of the weight and distance components).",
      "when": {
        "special_handling": "cold_chain"
      }
    }
  ],
  "unmatched_lines": {
    "clause": "§5",
    "payable": false,
    "quote": "Lines that cannot be matched to a booking are not payable until reconciled."
  },
  "unsupported": []
}
