{
  "accessorials": [
    {
      "amount": "150.00",
      "clause": "§4",
      "label": "protected handling",
      "quote": "Consignments booked as fragile are handled under the Carrier's protected-handling process at ₹150.00 per consignment, in addition to freight.",
      "when": {
        "special_handling": "fragile"
      }
    }
  ],
  "carrier": "alpine",
  "chargeable_weight": {
    "clause": "§1",
    "minimum_kg": "25",
    "quote": "which is the higher of the consignment's actual weight and the minimum chargeable weight of 25 kg"
  },
  "contract_file": "alpine-express.md",
  "contract_sha256": "caa39649f701795356f6545c0a6c86ea12b2037dc96080027bdf8f17801e6001",
  "credit_notes": null,
  "dispute_window": null,
  "freight": {
    "components": [
      {
        "bands": [
          {
            "max_inclusive": false,
            "max_kg": "50",
            "min_inclusive": true,
            "min_kg": null,
            "rate": "9.50"
          },
          {
            "max_inclusive": true,
            "max_kg": null,
            "min_inclusive": false,
            "min_kg": "50",
            "rate": "8.25"
          }
        ],
        "basis": "per_kg",
        "clause": "§2",
        "label": "freight",
        "quote": "consignments under 50 kg: ₹9.50 per kg of chargeable weight ... consignments over 50 kg: ₹8.25 per kg of chargeable weight",
        "weight_basis": "chargeable"
      }
    ]
  },
  "invoice_discounts": [
    {
      "clause": "§5",
      "count_basis": "tendered",
      "kind": "volume",
      "pct": "5",
      "period": "calendar_month",
      "quote": "In any calendar month in which the Customer tenders more than 12 consignments, the Carrier will apply a 5% discount to the invoice total for that month's invoice.",
      "threshold_gt": 12
    }
  ],
  "non_pricing": [
    {
      "clause": "§6",
      "summary": "The Carrier invoices monthly; payment is due 30 days from invoice date."
    },
    {
      "clause": "§7",
      "summary": "Rate revisions require 60 days' written notice and take effect from the first day of the following calendar month."
    }
  ],
  "other_accessorials": {
    "allowed": false,
    "clause": "§1",
    "quote": "Freight is charged on chargeable weight"
  },
  "service_levels": {
    "allowed": [
      "standard"
    ],
    "clause": "§3",
    "quote": "All bookings travel on standard service. Express products are not offered under this agreement."
  },
  "surcharges": [],
  "unmatched_lines": null,
  "unsupported": []
}
