{
  "contract_file": "falcon-freight.md",
  "contract_sha256": "0000000000000000000000000000000000000000000000000000000000000000",
  "carrier": "falcon",
  "freight": {
    "components": [
      {
        "basis": "per_km",
        "weight_basis": "billed",
        "bands": [
          {"min_kg": null, "min_inclusive": true, "max_kg": "500", "max_inclusive": true, "rate": "18.00"},
          {"min_kg": "501", "min_inclusive": true, "max_kg": "2000", "max_inclusive": true, "rate": "24.00"}
        ],
        "label": "base freight",
        "clause": "§1",
        "quote": "up to and including 500 kg: ₹18.00 per km ... 501 kg to 2,000 kg: ₹24.00 per km"
      }
    ]
  },
  "chargeable_weight": null,
  "service_levels": {"allowed": ["standard", "express"], "clause": "§2", "quote": "Express service, where booked"},
  "surcharges": [
    {"pct": "15", "base": "freight", "when": {"service_level": "express"}, "label": "express premium",
     "clause": "§2", "quote": "Express service, where booked, carries a premium of 15% of the base freight"},
    {"pct": "12", "base": "freight_and_prior_surcharges", "when": {"always": true}, "label": "fuel surcharge",
     "clause": "§3", "quote": "A fuel surcharge of 12% applies to the freight charge (base freight plus express premium, where applicable)"}
  ],
  "accessorials": [
    {"amount": "250.00", "when": {"special_handling": "residential"}, "label": "residential delivery",
     "clause": "§4", "quote": "Residential delivery (consignee address is a residence, or the booking is flagged residential): ₹250.00 flat per consignment"}
  ],
  "other_accessorials": {"allowed": false, "clause": "§5", "quote": "No other accessorial charges are payable under this agreement"},
  "invoice_discounts": [],
  "credit_notes": {"allowed": true, "must_cover_full": false, "clause": "§8",
                   "quote": "The Carrier may issue credit notes correcting earlier invoices"},
  "unmatched_lines": null,
  "dispute_window": {"days": 45, "from": "invoice_date", "clause": "§7",
                     "quote": "Billing disputes must be raised within 45 days of invoice date"},
  "non_pricing": [{"clause": "§6", "summary": "Fortnightly invoicing; payment due 30 days from invoice date"}],
  "unsupported": []
}
